<?xml version="1.0" encoding="UTF-8"?>
<lib:libreria 
		xmlns:lib="http://www.example.org/libreria" 
		xmlns:xsi="http://www.w3.org/2001/XMLSchema-instance" 
		xsi:schemaLocation="http://www.example.org/libreria ./libreria.xsd">
     <lib:libro>
        <lib:titulo>El Asedio</lib:titulo>
        <lib:autor>Arturo Pérez Reverte</lib:autor>
    </lib:libro>
    <lib:libro>
        <lib:titulo>El viaje de Baldassare</lib:titulo>
        <lib:autor>Amin Maalouf</lib:autor>
    </lib:libro>
    <lib:libro>
        <lib:titulo>La sombre del ciprés es alargada</lib:titulo>
        <lib:autor>Miguel Delibes</lib:autor>
    </lib:libro>
</lib:libreria>
